{
  "$schema": "https://json-schema.org/draft/2020-12/schema",
  "type": "object",
  "properties": {
    "title": {
      "default": "Sin Título",
      "type": "string"
    },
    "sitioGeohistorico": {
      "default": null,
      "anyOf": [
        {
          "type": "string"
        },
        {
          "type": "null"
        }
      ]
    },
    "volantaHook": {
      "default": null,
      "anyOf": [
        {
          "type": "string"
        },
        {
          "type": "null"
        }
      ]
    },
    "saberMasDato": {
      "default": null,
      "anyOf": [
        {
          "type": "string"
        },
        {
          "type": "null"
        }
      ]
    },
    "draft": {
      "default": false,
      "type": "boolean"
    },
    "date": {
      "default": null,
      "anyOf": [
        {
          "type": "string"
        },
        {
          "type": "null"
        }
      ]
    },
    "category": {
      "default": "Arqueosemiótica",
      "anyOf": [
        {
          "type": "string"
        },
        {
          "type": "null"
        }
      ]
    },
    "publicarConImagen": {
      "default": true,
      "type": "boolean"
    },
    "coverImage": {
      "default": null,
      "anyOf": [
        {
          "type": "string"
        },
        {
          "type": "null"
        }
      ]
    },
    "bancoImagenesWikimedia": {
      "default": null,
      "anyOf": [
        {
          "type": "string"
        },
        {
          "type": "null"
        }
      ]
    },
    "excerpt": {
      "default": "Sin descripción disponible.",
      "anyOf": [
        {
          "type": "string"
        },
        {
          "type": "null"
        }
      ]
    },
    "generadorGeoref": {
      "default": null,
      "anyOf": [
        {
          "type": "string"
        },
        {
          "type": "null"
        }
      ]
    },
    "$schema": {
      "type": "string"
    }
  }
}