{
  "title": "Cueva de las Manos: El Lenguaje Rupestre de la Patagonia",
  "sitioGeohistorico": "Cañadón del Río Pinturas (Santa Cruz, Patagonia, Argentina)",
  "volantaHook": "Cueva de las Manos: ¿Un archivo estético de 9.000 años o el primer manifiesto de presencia humana en el confín austral?",
  "saberMasDato": "El análisis microscópico de los pigmentos reveló que los cazadores-recolectores utilizaban pequeños tubos de hueso de choique como aerógrafos arcaicos. Al soplar la mezcla mineral con grasa de guanaco, sellaron un registro térmico y ritual que resistió milenios de viento patagónico.",
  "date": "2026-08-03",
  "category": "Arqueosemiótica",
  "publicarConImagen": true,
  "draft": false,
  "coverImage": "/src/assets/georreferencias/cueva-de-las-manos-patagonia/coverImage.jpg",
  "bancoImagenesWikimedia": "{\n  \"query\": \"cueva de las manos patagonia\",\n  \"count\": 4,\n  \"selectedItems\": [\n    {\n      \"id\": \"114482551\",\n      \"title\": \"Parque Nac. Patagonia.jpg\",\n      \"url\": \"https://upload.wikimedia.org/wikipedia/commons/d/d5/Parque_Nac._Patagonia.jpg?utm_source=commons.wikimedia.org&utm_campaign=imageinfo&utm_content=original\",\n      \"thumbUrl\": \"https://upload.wikimedia.org/wikipedia/commons/thumb/d/d5/Parque_Nac._Patagonia.jpg/960px-Parque_Nac._Patagonia.jpg?utm_source=commons.wikimedia.org&utm_campaign=imageinfo&utm_content=thumbnail\",\n      \"width\": 3872,\n      \"height\": 2592,\n      \"aspectRatio\": 1.49,\n      \"mime\": \"image/jpeg\",\n      \"role\": \"HERO\",\n      \"roleLabel\": \"Hero Image (Encabezado Panorámico)\",\n      \"author\": \"LeandroBaud\",\n      \"license\": \"CC BY-SA 4.0\",\n      \"licenseUrl\": \"https://creativecommons.org/licenses/by-sa/4.0\",\n      \"description\": \"Cueva de las Manos. Pinturas rupestres.\",\n      \"credit\": \"<span class=\\\"int-own-work\\\" lang=\\\"en\\\">Own work</span>\",\n      \"pageUrl\": \"https://commons.wikimedia.org/wiki/File:Parque_Nac._Patagonia.jpg\"\n    },\n    {\n      \"id\": \"44309374\",\n      \"title\": \"Museo de Ciencias Naturales de Valencia AD 01.JPG\",\n      \"url\": \"https://upload.wikimedia.org/wikipedia/commons/9/9f/Museo_de_Ciencias_Naturales_de_Valencia_AD_01.JPG?utm_source=commons.wikimedia.org&utm_campaign=imageinfo&utm_content=original\",\n      \"thumbUrl\": \"https://upload.wikimedia.org/wikipedia/commons/thumb/9/9f/Museo_de_Ciencias_Naturales_de_Valencia_AD_01.JPG/960px-Museo_de_Ciencias_Naturales_de_Valencia_AD_01.JPG?utm_source=commons.wikimedia.org&utm_campaign=imageinfo&utm_content=thumbnail\",\n      \"width\": 3648,\n      \"height\": 2736,\n      \"aspectRatio\": 1.33,\n      \"mime\": \"image/jpeg\",\n      \"role\": \"SECUNDARIA\",\n      \"roleLabel\": \"Imagen Secundaria (Editorial)\",\n      \"author\": \"19Tarrestnom65\",\n      \"license\": \"CC BY-SA 4.0\",\n      \"licenseUrl\": \"https://creativecommons.org/licenses/by-sa/4.0\",\n      \"description\": \"Recreación de la Cueva de las Manos en Santa Cruz, Patagonia, Argentina.\",\n      \"credit\": \"<span class=\\\"int-own-work\\\" lang=\\\"en\\\">Own work</span>\",\n      \"pageUrl\": \"https://commons.wikimedia.org/wiki/File:Museo_de_Ciencias_Naturales_de_Valencia_AD_01.JPG\"\n    },\n    {\n      \"id\": \"19624782\",\n      \"title\": \"Cueva de las Manos-Santa Cruz-Argentina.JPG\",\n      \"url\": \"https://upload.wikimedia.org/wikipedia/commons/3/36/Cueva_de_las_Manos-Santa_Cruz-Argentina.JPG?utm_source=commons.wikimedia.org&utm_campaign=imageinfo&utm_content=original\",\n      \"thumbUrl\": \"https://upload.wikimedia.org/wikipedia/commons/thumb/3/36/Cueva_de_las_Manos-Santa_Cruz-Argentina.JPG/960px-Cueva_de_las_Manos-Santa_Cruz-Argentina.JPG?utm_source=commons.wikimedia.org&utm_campaign=imageinfo&utm_content=thumbnail\",\n      \"width\": 2816,\n      \"height\": 2112,\n      \"aspectRatio\": 1.33,\n      \"mime\": \"image/jpeg\",\n      \"role\": \"SECUNDARIA\",\n      \"roleLabel\": \"Imagen Secundaria (Editorial)\",\n      \"author\": \"Maxima20\",\n      \"license\": \"CC BY-SA 3.0\",\n      \"licenseUrl\": \"https://creativecommons.org/licenses/by-sa/3.0\",\n      \"description\": \"Patagonia Argentina\",\n      \"credit\": \"<span class=\\\"int-own-work\\\" lang=\\\"en\\\">Own work</span>\",\n      \"pageUrl\": \"https://commons.wikimedia.org/wiki/File:Cueva_de_las_Manos-Santa_Cruz-Argentina.JPG\"\n    },\n    {\n      \"id\": \"19624783\",\n      \"title\": \"Cañadón del Río Pinturas - Cueva de las Manos-Sta Cruz-Argentina.JPG\",\n      \"url\": \"https://upload.wikimedia.org/wikipedia/commons/3/36/Ca%C3%B1ad%C3%B3n_del_R%C3%ADo_Pinturas_-_Cueva_de_las_Manos-Sta_Cruz-Argentina.JPG?utm_source=commons.wikimedia.org&utm_campaign=imageinfo&utm_content=original\",\n      \"thumbUrl\": \"https://upload.wikimedia.org/wikipedia/commons/thumb/3/36/Ca%C3%B1ad%C3%B3n_del_R%C3%ADo_Pinturas_-_Cueva_de_las_Manos-Sta_Cruz-Argentina.JPG/960px-Ca%C3%B1ad%C3%B3n_del_R%C3%ADo_Pinturas_-_Cueva_de_las_Manos-Sta_Cruz-Argentina.JPG?utm_source=commons.wikimedia.org&utm_campaign=imageinfo&utm_content=thumbnail\",\n      \"width\": 2816,\n      \"height\": 2112,\n      \"aspectRatio\": 1.33,\n      \"mime\": \"image/jpeg\",\n      \"role\": \"SECUNDARIA\",\n      \"roleLabel\": \"Imagen Secundaria (Editorial)\",\n      \"author\": \"Maxima20\",\n      \"license\": \"CC BY-SA 3.0\",\n      \"licenseUrl\": \"https://creativecommons.org/licenses/by-sa/3.0\",\n      \"description\": \"Patagonia Argentina\",\n      \"credit\": \"<span class=\\\"int-own-work\\\" lang=\\\"en\\\">Own work</span>\",\n      \"pageUrl\": \"https://commons.wikimedia.org/wiki/File:Ca%C3%B1ad%C3%B3n_del_R%C3%ADo_Pinturas_-_Cueva_de_las_Manos-Sta_Cruz-Argentina.JPG\"\n    }\n  ]\n}",
  "excerpt": "En el profundo cañadón del Río Pinturas, la Cueva de las Manos custodia más de 9.000 años de improntas negativas y escenas de caza, conformando uno de los testimonios de arte rupestre y semiótica arcaica más sobrecogedores de América del Sur."
}