{
  "title": "Meroe y la Dinastía Negra: El Códice de las Pirámides Nubias",
  "sitioGeohistorico": "Meroe y la Dinastía Negra: El Códice de las Pirámides Nubias",
  "volantaHook": "¿Fue Meroe el crisol metalúrgico de los faraones negros o un vórtice de saberes perdidos en el desierto nubio?",
  "saberMasDato": "Las milenarias colinas de escoria de hierro vitrificada de Meroe funcionan como litófonos naturales. Los pastores nómadas las golpean para comunicarse, generando resonancias metálicas que hacen 'cantar' al desierto nubio.",
  "date": "2026-08-21",
  "category": "Arqueosemiótica",
  "publicarConImagen": true,
  "draft": false,
  "coverImage": "/src/assets/georreferencias/meroe-y-la-dinasta-negra-el-cdice-de-las-pirmides-nubias/coverImage.jpg",
  "bancoImagenesWikimedia": null,
  "excerpt": "Meroe es el epicentro monumental del Reino de Kush, famoso por sus escarpadas pirámides nubias, su industria del hierro y un enigmático idioma aún indescifrado.",
  "generadorGeoref": "## Georreferencias Arqueosemióticas: Meroe y la Dinastía Negra\n\n> ¿Fue Meroe el crisol metalúrgico de los faraones negros o un vórtice de saberes perdidos en el desierto nubio?\n\n### 1. Marco Geohistórico & Datos Arqueológicos\nUbicada en la orilla oriental del río Nilo, en el actual Sudán, Meroe fue la capital meridional del Reino de Kush a partir del siglo VI a.C. y el corazón del imperio tras la caída de Napata. Aunque los denominados \"faraones negros\" (la Dinastía XXV de Egipto) gobernaron principalmente desde Napata, Meroe heredó y expandió esta profunda hibridación cultural, perpetuando tradiciones faraónicas con marcados rasgos africanos. El sitio arqueológico es mundialmente reconocido por sus más de doscientas pirámides de base estrecha y ángulo escarpado, construidas como monumentos funerarios para la realeza kushita. Además de su arquitectura, Meroe dejó un corpus epigráfico fundamental: la escritura meroítica, cuyo alfabeto fue descifrado a principios del siglo XX, pero cuyo vocabulario y sintaxis siguen siendo un misterio insondable para la lingüística moderna.\n\n### 2. Contexto Geológico & Entorno Natural\nMeroe se emplaza en la región de Butana, flanqueada por el Nilo y el río Atbara. Su geología está dominada por la arenisca nubia, una roca sedimentaria rica en cuarzo y óxidos de hierro que confiere a las pirámides su característico tono rojizo. Precisamente, la abundancia de mineral de hierro y de bosques de acacias (utilizados como combustible) convirtió a Meroe en el principal centro de fundición de hierro de la antigüedad africana, al punto de que los arqueólogos la denominaron \"la Birmingham de África\". En la actualidad, enormes montículos de escoria ferrosa se alzan aún en la periferia de la antigua ciudad, atestiguando un paisaje que fue intensamente modificado por la industria protohistórica y la erosión eólica del desierto del Sahara.\n\n### 3. Registro Etnográfico & Población Local\nLa región que rodea Meroe está habitada principalmente por comunidades de etnia árabe Ja'alin y descendientes nubios, cuyas formas de vida combinan el pastoreo nómada con la agricultura de subsistencia a orillas del Nilo. Para los pobladores locales, las pirámides de \"Tarabil\" (como se las conoce coloquialmente) son motivos de un profundo orgullo identitario y, antes de los recientes conflictos geopolíticos sudaneses, constituían la principal fuente de ingresos a través del turismo. La tradición oral beduina suele referirse a los reyes kushitas como gigantes ancestrales o \"reyes-magos\" que dominaban el fuego y los metales, manteniendo una relación de respeto supersticioso hacia los recintos funerarios, de los cuales se dice que resguardan guardianes espirituales (jinn) vinculados a la realeza sepultada.\n\n### 4. Hermenéutica de las Teorías Alternativas\nComo todo sitio de monumentalidad atípica, Meroe ha atraído lecturas heterodoxas. Desde la esotería contemporánea, se argumenta que el inusual ángulo de 70 grados de las pirámides kushitas responde a principios de geometría sagrada destinados a canalizar corrientes telúricas o \"líneas ley\" que conectan con otros vórtices africanos, como el Gran Zimbabue. Asimismo, ciertas vertientes del misticismo afrocéntrico ven en Meroe un enclave de tecnología superior silenciada por la egiptología eurocéntrica, postulando incluso una herencia de conocimientos antediluvianos, atlánticos o extraterrestres ligados al enigmático dios león Apedemak. Abordadas desde la arqueosemiótica, estas teorías operan como mecanismos de revalorización mítica: intentan subsanar el vacío historiográfico occidental dotando al paisaje nubio de un aura de hiper-civilización, donde el dominio del hierro se transfigura en alquimia y la escritura indescifrable en códigos interdimensionales.\n\n### 5. Saber Más: La Historia dentro de la Historia\nEntre las montañas de arena y ruinas, las inmensas colinas de escoria de hierro que rodean Meroe ocultan un secreto acústico. Debido a las extremas temperaturas de las antiguas fundiciones, gran parte de los residuos se vitrificaron, adquiriendo una inusual densidad metálica. En la actualidad, algunos pastores locales utilizan estas piedras como litófonos: al ser golpeadas, emiten resonancias similares a las de una campana de hierro, un eco que viaja kilómetros a través del silencio del desierto. Esta \"música de la escoria\" es un remanente inaudito de la era industrial de los faraones negros, uniendo la vida pastoril moderna con el pulso metalúrgico del antiguo imperio."
}
