{
  "title": "Yonaguni: El Enigma Sumergido",
  "sitioGeohistorico": "Monumento de Yonaguni (Archipiélago Ryūkyū, Japón)",
  "volantaHook": "Yonaguni: ¿La Atlántida japonesa o una anomalía tectónica en el abismo del Pacífico?",
  "saberMasDato": "La cosmovisión local ryukyuana conecta estas formaciones con el 'Nirai Kanai', el reino mítico oceánico de donde provienen los dioses y la vida. Para las sacerdotisas ancestrales, el sitio posee un estatus sagrado que precede y supera cualquier hipótesis sobre ciudades perdidas.",
  "date": "2026-08-03",
  "category": "Arqueosemiótica",
  "publicarConImagen": true,
  "draft": false,
  "coverImage": "/src/assets/georreferencias/yonaguni/coverImage.jpg",
  "bancoImagenesWikimedia": "{\n  \"query\": \"yonaguni\",\n  \"count\": 7,\n  \"selectedItems\": [\n    {\n      \"id\": \"95848615\",\n      \"title\": \"Yonaguni Island Aerial photograph.2012.jpg\",\n      \"url\": \"https://storage.thegreatpuzzleproject.com/Yonaguni_Island_Aerial_photograph.2012.jpg\",\n      \"thumbUrl\": \"https://storage.thegreatpuzzleproject.com/Yonaguni_Island_Aerial_photograph.2012.jpg\",\n      \"width\": 6546,\n      \"height\": 3000,\n      \"aspectRatio\": 2.18,\n      \"mime\": \"image/jpeg\",\n      \"role\": \"HERO\",\n      \"roleLabel\": \"Hero Image (Encabezado Panorámico)\",\n      \"author\": \"国土地理院\",\n      \"license\": \"Attribution\",\n      \"licenseUrl\": \"https://commons.wikimedia.org\",\n      \"description\": \"Yonaguni Island Aerial photograph.2012\",\n      \"credit\": \"国土情報ウェブマッピングシステム\",\n      \"pageUrl\": \"https://commons.wikimedia.org/wiki/File:Yonaguni_Island_Aerial_photograph.2012.jpg\"\n    },\n    {\n      \"id\": \"80331960\",\n      \"title\": \"Yonaguni Monument Terraces midpart NWW.jpg\",\n      \"url\": \"https://storage.thegreatpuzzleproject.com/Yonaguni_Monument_Terraces_midpart_NWW.jpg\",\n      \"thumbUrl\": \"https://storage.thegreatpuzzleproject.com/Yonaguni_Monument_Terraces_midpart_NWW.jpg\",\n      \"width\": 4608,\n      \"height\": 3456,\n      \"aspectRatio\": 1.33,\n      \"mime\": \"image/jpeg\",\n      \"role\": \"SECUNDARIA\",\n      \"roleLabel\": \"Imagen Secundaria (Editorial)\",\n      \"author\": \"Melkov\",\n      \"license\": \"CC0\",\n      \"licenseUrl\": \"http://creativecommons.org/publicdomain/zero/1.0/deed.en\",\n      \"description\": \"\\\"Main terrace\\\" on the left, \\\"straight wall\\\" on the front.\",\n      \"credit\": \"<span class=\\\"int-own-work\\\" lang=\\\"en\\\">Own work</span>\",\n      \"pageUrl\": \"https://commons.wikimedia.org/wiki/File:Yonaguni_Monument_Terraces_midpart_NWW.jpg\"\n    },\n    {\n      \"id\": \"81062289\",\n      \"title\": \"Yonaguni Monument Water Trench.jpg\",\n      \"url\": \"https://storage.thegreatpuzzleproject.com/Yonaguni_Monument_Water_Trench.jpg\",\n      \"thumbUrl\": \"https://storage.thegreatpuzzleproject.com/Yonaguni_Monument_Water_Trench.jpg\",\n      \"width\": 3456,\n      \"height\": 4608,\n      \"aspectRatio\": 0.75,\n      \"mime\": \"image/jpeg\",\n      \"role\": \"B_ROLL\",\n      \"roleLabel\": \"B-Roll / Relleno (Detalles)\",\n      \"author\": \"Melkov\",\n      \"license\": \"CC0\",\n      \"licenseUrl\": \"http://creativecommons.org/publicdomain/zero/1.0/deed.en\",\n      \"description\": \"A feature that looks like a water trench that crosses the upper part of Yonaguni Monument\",\n      \"credit\": \"<span class=\\\"int-own-work\\\" lang=\\\"en\\\">Own work</span>\",\n      \"pageUrl\": \"https://commons.wikimedia.org/wiki/File:Yonaguni_Monument_Water_Trench.jpg\"\n    },\n    {\n      \"id\": \"81113696\",\n      \"title\": \"Yonaguni Monument Main Terrace.jpg\",\n      \"url\": \"https://storage.thegreatpuzzleproject.com/Yonaguni_Monument_Main_Terrace.jpg\",\n      \"thumbUrl\": \"https://storage.thegreatpuzzleproject.com/Yonaguni_Monument_Main_Terrace.jpg\",\n      \"width\": 4608,\n      \"height\": 3456,\n      \"aspectRatio\": 1.33,\n      \"mime\": \"image/jpeg\",\n      \"role\": \"SECUNDARIA\",\n      \"roleLabel\": \"Imagen Secundaria (Editorial)\",\n      \"author\": \"Melkov\",\n      \"license\": \"CC0\",\n      \"licenseUrl\": \"http://creativecommons.org/publicdomain/zero/1.0/deed.en\",\n      \"description\": \"A part of Yonaguni Monument that is called the Main Terrace, underwater near Yonaguni Island, Japan\",\n      \"credit\": \"<span class=\\\"int-own-work\\\" lang=\\\"en\\\">Own work</span>\",\n      \"pageUrl\": \"https://commons.wikimedia.org/wiki/File:Yonaguni_Monument_Main_Terrace.jpg\"\n    },\n    {\n      \"id\": \"77104720\",\n      \"title\": \"Yonaguni Monument Twin Megaliths.jpg\",\n      \"url\": \"https://storage.thegreatpuzzleproject.com/Yonaguni_Monument_Twin_Megaliths.jpg\",\n      \"thumbUrl\": \"https://storage.thegreatpuzzleproject.com/Yonaguni_Monument_Twin_Megaliths.jpg\",\n      \"width\": 3216,\n      \"height\": 4288,\n      \"aspectRatio\": 0.75,\n      \"mime\": \"image/jpeg\",\n      \"role\": \"B_ROLL\",\n      \"roleLabel\": \"B-Roll / Relleno (Detalles)\",\n      \"author\": \"Melkov\",\n      \"license\": \"CC0\",\n      \"licenseUrl\": \"http://creativecommons.org/publicdomain/zero/1.0/deed.en\",\n      \"description\": \"Two huge rectangular stone slabs laying perfectly parallel to each other\",\n      \"credit\": \"<span class=\\\"int-own-work\\\" lang=\\\"en\\\">Own work</span>\",\n      \"pageUrl\": \"https://commons.wikimedia.org/wiki/File:Yonaguni_Monument_Twin_Megaliths.jpg\"\n    },\n    {\n      \"id\": \"77104722\",\n      \"title\": \"Big Turtle Rock 大亀石 near the Yonaguni Monument.jpg\",\n      \"url\": \"https://storage.thegreatpuzzleproject.com/Big_Turtle_Rock_%E5%A4%A7%E4%BA%80%E7%9F%B3_near_the_Yonaguni_Monument.jpg\",\n      \"thumbUrl\": \"https://storage.thegreatpuzzleproject.com/Big_Turtle_Rock_%E5%A4%A7%E4%BA%80%E7%9F%B3_near_the_Yonaguni_Monument.jpg\",\n      \"width\": 4288,\n      \"height\": 3216,\n      \"aspectRatio\": 1.33,\n      \"mime\": \"image/jpeg\",\n      \"role\": \"SECUNDARIA\",\n      \"roleLabel\": \"Imagen Secundaria (Editorial)\",\n      \"author\": \"Melkov\",\n      \"license\": \"CC0\",\n      \"licenseUrl\": \"http://creativecommons.org/publicdomain/zero/1.0/deed.en\",\n      \"description\": \"The stone seems to be cut in such a way that it resembles a turtle. Triangular \\\"head\\\" is on the left.\",\n      \"credit\": \"<span class=\\\"int-own-work\\\" lang=\\\"en\\\">Own work</span>\",\n      \"pageUrl\": \"https://commons.wikimedia.org/wiki/File:Big_Turtle_Rock_%E5%A4%A7%E4%BA%80%E7%9F%B3_near_the_Yonaguni_Monument.jpg\"\n    },\n    {\n      \"id\": \"5198405\",\n      \"title\": \"Yonaguni horse 1.jpg\",\n      \"url\": \"https://storage.thegreatpuzzleproject.com/Yonaguni_horse_1.jpg\",\n      \"thumbUrl\": \"https://storage.thegreatpuzzleproject.com/Yonaguni_horse_1.jpg\",\n      \"width\": 3888,\n      \"height\": 2600,\n      \"aspectRatio\": 1.5,\n      \"mime\": \"image/jpeg\",\n      \"role\": \"HERO\",\n      \"roleLabel\": \"Hero Image (Encabezado Panorámico)\",\n      \"author\": \"sota\",\n      \"license\": \"CC BY-SA 2.0\",\n      \"licenseUrl\": \"https://creativecommons.org/licenses/by-sa/2.0\",\n      \"description\": \"@Yonaguni Island\",\n      \"credit\": \"originally posted to <b><a href=\\\"//commons.wikimedia.org/wiki/Flickr\\\" class=\\\"mw-redirect\\\" title=\\\"Flickr\\\">Flickr</a></b> as <a rel=\\\"nofollow\\\" class=\\\"external text\\\" href=\\\"https://www.flickr.com/photos/21493557@N00/1842676036\\\">南牧場の馬たち_1</a>\",\n      \"pageUrl\": \"https://commons.wikimedia.org/wiki/File:Yonaguni_horse_1.jpg\"\n    }\n  ]\n}",
  "excerpt": "El Monumento de Yonaguni es una controvertida formación rocosa submarina en Japón que divide opiniones entre procesos tectónicos naturales y ruinas de una civilización perdida. Este informe aborda su compleja geología, el impacto etnográfico local y su análisis como lienzo de mitos contemporáneos."
}
